{
  "$schema": "https://json-schema.org/draft/2020-12/schema",
  "title": "Tangle scene",
  "type": "object",
  "required": [
    "duration_s",
    "fps",
    "objects",
    "backdrop"
  ],
  "additionalProperties": false,
  "properties": {
    "duration_s": {
      "type": "number",
      "exclusiveMinimum": 0,
      "maximum": 30
    },
    "fps": {
      "type": "integer",
      "minimum": 1,
      "maximum": 60
    },
    "objects": {
      "type": "array",
      "minItems": 1,
      "maxItems": 12,
      "items": {
        "type": "object",
        "required": [
          "id",
          "type",
          "keyframes"
        ],
        "additionalProperties": false,
        "properties": {
          "id": {
            "type": "string",
            "pattern": "^[a-z][a-z0-9_]*$"
          },
          "type": {
            "enum": [
              "can",
              "box",
              "sphere",
              "text",
              "particles",
              "photo"
            ]
          },
          "color": {
            "type": "string",
            "pattern": "^#[0-9a-fA-F]{3,6}$"
          },
          "label_text": {
            "type": "string",
            "maxLength": 24
          },
          "text": {
            "type": "string",
            "maxLength": 40
          },
          "height_m": {
            "type": "number",
            "minimum": 0.1,
            "maximum": 3
          },
          "keyframes": {
            "type": "array",
            "minItems": 1,
            "items": {
              "type": "object",
              "required": [
                "t",
                "pos",
                "rot",
                "scale"
              ],
              "additionalProperties": false,
              "properties": {
                "t": {
                  "type": "number",
                  "minimum": 0
                },
                "pos": {
                  "type": "array",
                  "items": {
                    "type": "number"
                  },
                  "minItems": 3,
                  "maxItems": 3
                },
                "rot": {
                  "type": "array",
                  "items": {
                    "type": "number"
                  },
                  "minItems": 3,
                  "maxItems": 3
                },
                "scale": {
                  "type": "number",
                  "minimum": 0,
                  "maximum": 5
                }
              }
            }
          },
          "label_image": {
            "type": "string",
            "maxLength": 200,
            "description": "Optional repo-relative PNG path for the hero can's label texture (no '..', no absolute path, no URL). If the file is missing the renderer falls back to label_text.",
            "pattern": "^(?![A-Za-z][A-Za-z0-9+.-]*:)(?!/)(?!.*\\.\\.).+\\.png$"
          },
          "image": {
            "type": "string",
            "maxLength": 200,
            "description": "photo cards only: repo-relative PNG or JPG path of the card's picture (no '..', no absolute path, no URL). The card is a flat quad in the local XY plane, normal +z, centred on the keyframe position, width_m wide; height is height_m if given, else width_m / image aspect.",
            "pattern": "^(?![A-Za-z][A-Za-z0-9+.-]*:)(?!/)(?!.*\\.\\.).+\\.(png|jpg|jpeg)$"
          },
          "width_m": {
            "type": "number",
            "minimum": 0.2,
            "maximum": 8,
            "description": "photo cards only: card width in metres at scale 1"
          },
          "blend": {
            "enum": [
              "normal",
              "add"
            ],
            "description": "photo cards only: 'add' = additive blending, so black counts as transparent (an LED panel is black when off). Generate the picture on a pure black background."
          }
        },
        "allOf": [
          {
            "if": {
              "properties": {
                "type": {
                  "const": "text"
                }
              }
            },
            "then": {
              "required": [
                "text",
                "height_m"
              ]
            }
          },
          {
            "if": {
              "properties": {
                "type": {
                  "const": "photo"
                }
              },
              "required": [
                "type"
              ]
            },
            "then": {
              "required": [
                "image",
                "width_m"
              ]
            }
          }
        ]
      }
    },
    "backdrop": {
      "type": "object",
      "required": [
        "type",
        "depth_m",
        "color"
      ],
      "additionalProperties": false,
      "properties": {
        "type": {
          "enum": [
            "room"
          ]
        },
        "depth_m": {
          "type": "number",
          "minimum": 1,
          "maximum": 20
        },
        "color": {
          "type": "string",
          "pattern": "^#[0-9a-fA-F]{3,6}$"
        }
      }
    }
  }
}
