{
 "duration_s": 10,
 "fps": 30,
 "backdrop": {
  "type": "room",
  "depth_m": 6,
  "color": "#1a0b05"
 },
 "objects": [
  {
   "id": "pedestal",
   "type": "box",
   "color": "#3d1e10",
   "keyframes": [
    {
     "t": 0,
     "pos": [
      -3,
      0.5,
      -3
     ],
     "rot": [
      0,
      45,
      0
     ],
     "scale": 1.5
    },
    {
     "t": 3.5,
     "pos": [
      -3,
      0.5,
      -3
     ],
     "rot": [
      0,
      135,
      0
     ],
     "scale": 1.5
    },
    {
     "t": 4.2,
     "pos": [
      -3,
      0.2,
      -3
     ],
     "rot": [
      0,
      180,
      0
     ],
     "scale": 0
    }
   ]
  },
  {
   "id": "core_glow",
   "type": "sphere",
   "color": "#ff9900",
   "keyframes": [
    {
     "t": 0,
     "pos": [
      -3,
      2.5,
      -3
     ],
     "rot": [
      0,
      0,
      0
     ],
     "scale": 0.2
    },
    {
     "t": 3.5,
     "pos": [
      -2,
      2.5,
      -2
     ],
     "rot": [
      0,
      0,
      0
     ],
     "scale": 0.5
    },
    {
     "t": 4.0,
     "pos": [
      -1.5,
      2.8,
      -1.5
     ],
     "rot": [
      0,
      0,
      0
     ],
     "scale": 0.5
    },
    {
     "t": 4.5,
     "pos": [
      0,
      2.8,
      0
     ],
     "rot": [
      0,
      0,
      0
     ],
     "scale": 0
    }
   ]
  },
  {
   "id": "hero_can",
   "type": "can",
   "color": "#ff4500",
   "label_text": "FLARE",
   "keyframes": [
    {
     "t": 0,
     "pos": [
      -3,
      2.5,
      -3
     ],
     "rot": [
      10,
      0,
      -10
     ],
     "scale": 1.5
    },
    {
     "t": 2.0,
     "pos": [
      -2.5,
      2.7,
      -2.5
     ],
     "rot": [
      10,
      360,
      -10
     ],
     "scale": 1.6
    },
    {
     "t": 3.5,
     "pos": [
      -1.0,
      2.8,
      -1.0
     ],
     "rot": [
      0,
      720,
      0
     ],
     "scale": 1.8
    },
    {
     "t": 4.0,
     "pos": [
      0,
      2.8,
      0
     ],
     "rot": [
      0,
      720,
      0
     ],
     "scale": 2.0
    },
    {
     "t": 4.8,
     "pos": [
      0,
      2.8,
      0
     ],
     "rot": [
      0,
      720,
      0
     ],
     "scale": 2.4
    },
    {
     "t": 7.5,
     "pos": [
      0,
      2.8,
      0
     ],
     "rot": [
      0,
      720,
      0
     ],
     "scale": 2.45
    },
    {
     "t": 10.0,
     "pos": [
      0,
      2.8,
      0
     ],
     "rot": [
      0,
      720,
      0
     ],
     "scale": 2.4
    }
   ]
  },
  {
   "id": "sparks_gold",
   "type": "particles",
   "color": "#ffd700",
   "keyframes": [
    {
     "t": 3.8,
     "pos": [
      -0.5,
      2.8,
      -0.5
     ],
     "rot": [
      0,
      0,
      0
     ],
     "scale": 0.2
    },
    {
     "t": 3.9,
     "pos": [
      0,
      2.8,
      0
     ],
     "rot": [
      0,
      0,
      0
     ],
     "scale": 0.05
    },
    {
     "t": 5.2,
     "pos": [
      0,
      2.8,
      0
     ],
     "rot": [
      0,
      0,
      0
     ],
     "scale": 0.05
    },
    {
     "t": 9.9,
     "pos": [
      0,
      2.8,
      0
     ],
     "rot": [
      0,
      0,
      0
     ],
     "scale": 0.05
    },
    {
     "t": 10.0,
     "pos": [
      2.3,
      2.2,
      2.3
     ],
     "rot": [
      240,
      420,
      150
     ],
     "scale": 0
    }
   ]
  },
  {
   "id": "sparks_cream",
   "type": "particles",
   "color": "#fffdd0",
   "keyframes": [
    {
     "t": 4.0,
     "pos": [
      0,
      2.9,
      0
     ],
     "rot": [
      0,
      0,
      0
     ],
     "scale": 0.5
    },
    {
     "t": 4.1,
     "pos": [
      0,
      2.9,
      0
     ],
     "rot": [
      0,
      0,
      0
     ],
     "scale": 0.05
    },
    {
     "t": 9.9,
     "pos": [
      0,
      2.9,
      0
     ],
     "rot": [
      0,
      0,
      0
     ],
     "scale": 0.05
    },
    {
     "t": 10.0,
     "pos": [
      2.4,
      2.6,
      2.4
     ],
     "rot": [
      -180,
      400,
      -135
     ],
     "scale": 0
    }
   ]
  },
  {
   "id": "tagline",
   "type": "text",
   "text": "Light up the corner.",
   "height_m": 0.65,
   "color": "#fffdd0",
   "keyframes": [
    {
     "t": 5.8,
     "pos": [
      -4.2,
      3.2,
      -0.15
     ],
     "rot": [
      0,
      0,
      0
     ],
     "scale": 1.0
    },
    {
     "t": 6.4,
     "pos": [
      -4.2,
      3.2,
      -0.15
     ],
     "rot": [
      0,
      0,
      0
     ],
     "scale": 1.0
    },
    {
     "t": 10.0,
     "pos": [
      -4.2,
      3.2,
      -0.15
     ],
     "rot": [
      0,
      0,
      0
     ],
     "scale": 1.0
    }
   ]
  }
 ]
}