{
 "duration_s": 10,
 "fps": 30,
 "backdrop": {
  "type": "room",
  "depth_m": 6,
  "color": "#111622"
 },
 "objects": [
  {
   "id": "pedestal",
   "type": "box",
   "color": "#222a38",
   "keyframes": [
    {
     "t": 0,
     "pos": [
      -2.5,
      0.6,
      -2.5
     ],
     "rot": [
      0,
      45,
      0
     ],
     "scale": 1.2
    },
    {
     "t": 3.5,
     "pos": [
      -2.5,
      0.6,
      -2.5
     ],
     "rot": [
      0,
      135,
      0
     ],
     "scale": 1.2
    },
    {
     "t": 4.2,
     "pos": [
      -2.5,
      0.3,
      -2.5
     ],
     "rot": [
      0,
      180,
      0
     ],
     "scale": 0
    }
   ]
  },
  {
   "id": "volt_can",
   "type": "can",
   "color": "#ccff00",
   "label_text": "VOLT",
   "keyframes": [
    {
     "t": 0,
     "pos": [
      -1.3,
      2.5,
      0.0
     ],
     "rot": [
      0,
      0,
      0
     ],
     "scale": 1.8
    },
    {
     "t": 2.5,
     "pos": [
      -1.3,
      2.7,
      0.0
     ],
     "rot": [
      0,
      360,
      0
     ],
     "scale": 1.9
    },
    {
     "t": 3.5,
     "pos": [
      0.0,
      2.5,
      0.0
     ],
     "rot": [
      0,
      540,
      0
     ],
     "scale": 1.7
    },
    {
     "t": 4.0,
     "pos": [
      -1.3,
      2.6,
      0.0
     ],
     "rot": [
      0,
      680,
      0
     ],
     "scale": 2.0
    },
    {
     "t": 4.6,
     "pos": [
      -1.3,
      2.7,
      0.0
     ],
     "rot": [
      0,
      855,
      0
     ],
     "scale": 2.2
    },
    {
     "t": 6.5,
     "pos": [
      -1.3,
      2.8,
      0.0
     ],
     "rot": [
      0,
      920,
      0
     ],
     "scale": 2.2
    },
    {
     "t": 10.0,
     "pos": [
      -1.3,
      2.6,
      0.0
     ],
     "rot": [
      0,
      1035,
      0
     ],
     "scale": 2.1
    }
   ]
  },
  {
   "id": "energy_core",
   "type": "sphere",
   "color": "#00e5ff",
   "keyframes": [
    {
     "t": 2.5,
     "pos": [
      -2.0,
      2.7,
      -2.0
     ],
     "rot": [
      0,
      0,
      0
     ],
     "scale": 0.1
    },
    {
     "t": 3.5,
     "pos": [
      0.0,
      2.5,
      0.0
     ],
     "rot": [
      0,
      0,
      0
     ],
     "scale": 0.2
    },
    {
     "t": 4.0,
     "pos": [
      0.0,
      2.6,
      0.0
     ],
     "rot": [
      0,
      0,
      0
     ],
     "scale": 0
    },
    {
     "t": 4.5,
     "pos": [
      1.5,
      2.7,
      1.5
     ],
     "rot": [
      0,
      0,
      0
     ],
     "scale": 0
    }
   ]
  },
  {
   "id": "burst_sparks",
   "type": "particles",
   "color": "#ffee00",
   "keyframes": [
    {
     "t": 3.8,
     "pos": [
      -1.0,
      2.6,
      0.0
     ],
     "rot": [
      0,
      0,
      0
     ],
     "scale": 0.2
    },
    {
     "t": 4.6,
     "pos": [
      -1.0,
      2.7,
      0.0
     ],
     "rot": [
      0,
      180,
      0
     ],
     "scale": 0.3
    },
    {
     "t": 6.8,
     "pos": [
      -1.0,
      2.7,
      0.0
     ],
     "rot": [
      0,
      360,
      0
     ],
     "scale": 0.3
    },
    {
     "t": 8.0,
     "pos": [
      0.2,
      2.7,
      0.2
     ],
     "rot": [
      220,
      420,
      120
     ],
     "scale": 0
    }
   ]
  },
  {
   "id": "tagline",
   "type": "text",
   "text": "Break the frame.",
   "height_m": 0.7,
   "color": "#ffffff",
   "keyframes": [
    {
     "t": 5.2,
     "pos": [
      -4.2,
      3.2,
      -0.15
     ],
     "rot": [
      0,
      0,
      0
     ],
     "scale": 1.0
    },
    {
     "t": 5.8,
     "pos": [
      -4.2,
      3.2,
      -0.15
     ],
     "rot": [
      0,
      0,
      0
     ],
     "scale": 1.0
    },
    {
     "t": 10.0,
     "pos": [
      -4.2,
      3.2,
      -0.15
     ],
     "rot": [
      0,
      0,
      0
     ],
     "scale": 1.0
    }
   ]
  }
 ]
}