{
 "duration_s": 10,
 "fps": 30,
 "backdrop": {
  "type": "room",
  "depth_m": 6,
  "color": "#1A0908"
 },
 "objects": [
  {
   "id": "flare_can",
   "type": "can",
   "color": "#E8341C",
   "label_text": "FLARE",
   "keyframes": [
    {
     "t": 0,
     "pos": [
      -2.8,
      3,
      -2.8
     ],
     "rot": [
      0,
      0,
      12
     ],
     "scale": 0.2
    },
    {
     "t": 1.2,
     "pos": [
      -2.5,
      3,
      -2.5
     ],
     "rot": [
      10,
      180,
      -12
     ],
     "scale": 1.6
    },
    {
     "t": 3.8,
     "pos": [
      -2.2,
      3,
      -2.2
     ],
     "rot": [
      -10,
      540,
      15
     ],
     "scale": 1.8
    },
    {
     "t": 4.4,
     "pos": [
      -0.4,
      2.9,
      -0.4
     ],
     "rot": [
      15,
      660,
      -10
     ],
     "scale": 2.1
    },
    {
     "t": 5.3,
     "pos": [
      2.2,
      2.6,
      2.2
     ],
     "rot": [
      28,
      945,
      18
     ],
     "scale": 2.5
    },
    {
     "t": 7.2,
     "pos": [
      2.4,
      2.7,
      2.4
     ],
     "rot": [
      22,
      1080,
      -12
     ],
     "scale": 2.5
    },
    {
     "t": 8.5,
     "pos": [
      0.5,
      3,
      0.5
     ],
     "rot": [
      10,
      1260,
      8
     ],
     "scale": 2
    },
    {
     "t": 10,
     "pos": [
      -1.8,
      3,
      -1.8
     ],
     "rot": [
      0,
      1440,
      0
     ],
     "scale": 1.8
    }
   ]
  },
  {
   "id": "burst_particles",
   "type": "particles",
   "color": "#FF9E2C",
   "keyframes": [
    {
     "t": 4.2,
     "pos": [
      -0.5,
      2.9,
      -0.5
     ],
     "rot": [
      0,
      0,
      0
     ],
     "scale": 0.2
    },
    {
     "t": 5.4,
     "pos": [
      2,
      2.6,
      2
     ],
     "rot": [
      90,
      180,
      45
     ],
     "scale": 3.6
    },
    {
     "t": 7.6,
     "pos": [
      2.2,
      2.7,
      2.2
     ],
     "rot": [
      180,
      360,
      90
     ],
     "scale": 4.2
    },
    {
     "t": 9,
     "pos": [
      1.5,
      2.5,
      1.5
     ],
     "rot": [
      240,
      450,
      120
     ],
     "scale": 0
    }
   ]
  },
  {
   "id": "orange_orb_a",
   "type": "sphere",
   "color": "#FF6A00",
   "keyframes": [
    {
     "t": 4.3,
     "pos": [
      -0.3,
      2.9,
      -0.3
     ],
     "rot": [
      0,
      0,
      0
     ],
     "scale": 0.1
    },
    {
     "t": 5.5,
     "pos": [
      2.6,
      3.6,
      1.6
     ],
     "rot": [
      0,
      0,
      0
     ],
     "scale": 1
    },
    {
     "t": 7.5,
     "pos": [
      2.8,
      3.8,
      1.8
     ],
     "rot": [
      0,
      0,
      0
     ],
     "scale": 0.85
    },
    {
     "t": 8.8,
     "pos": [
      1.8,
      3.4,
      1.2
     ],
     "rot": [
      0,
      0,
      0
     ],
     "scale": 0
    }
   ]
  },
  {
   "id": "orange_orb_b",
   "type": "sphere",
   "color": "#FFB800",
   "keyframes": [
    {
     "t": 4.4,
     "pos": [
      -0.3,
      2.8,
      -0.3
     ],
     "rot": [
      0,
      0,
      0
     ],
     "scale": 0.1
    },
    {
     "t": 5.6,
     "pos": [
      1.5,
      1.6,
      2.6
     ],
     "rot": [
      0,
      0,
      0
     ],
     "scale": 0.85
    },
    {
     "t": 7.5,
     "pos": [
      1.7,
      1.4,
      2.8
     ],
     "rot": [
      0,
      0,
      0
     ],
     "scale": 0.7
    },
    {
     "t": 8.8,
     "pos": [
      1.2,
      1.6,
      1.8
     ],
     "rot": [
      0,
      0,
      0
     ],
     "scale": 0
    }
   ]
  },
  {
   "id": "tagline_text",
   "type": "text",
   "text": "Light up the corner.",
   "height_m": 0.6,
   "color": "#FFF3E0",
   "keyframes": [
    {
     "t": 6,
     "pos": [
      -4.2,
      3.2,
      -0.25
     ],
     "rot": [
      0,
      0,
      0
     ],
     "scale": 0.01
    },
    {
     "t": 6.8,
     "pos": [
      -4.2,
      3.2,
      -0.25
     ],
     "rot": [
      0,
      0,
      0
     ],
     "scale": 1.05
    },
    {
     "t": 7.2,
     "pos": [
      -4.2,
      3.2,
      -0.25
     ],
     "rot": [
      0,
      0,
      0
     ],
     "scale": 1
    },
    {
     "t": 10,
     "pos": [
      -4.2,
      3.2,
      -0.25
     ],
     "rot": [
      0,
      0,
      0
     ],
     "scale": 1
    }
   ]
  }
 ]
}
