{
 "duration_s": 10,
 "fps": 30,
 "objects": [
  {
   "id": "race_car",
   "type": "photo",
   "image": "web/hero/assets/car_on_black.png",
   "width_m": 4.0,
   "blend": "add",
   "keyframes": [
    {
     "t": 0,
     "pos": [
      -7,
      1.7,
      -0.8
     ],
     "rot": [
      0,
      45,
      0
     ],
     "scale": 0.8
    },
    {
     "t": 2.5,
     "pos": [
      -3,
      1.7,
      -0.8
     ],
     "rot": [
      0,
      45,
      0
     ],
     "scale": 1.0
    },
    {
     "t": 4.5,
     "pos": [
      -0.8,
      1.8,
      -0.8
     ],
     "rot": [
      0,
      45,
      0
     ],
     "scale": 1.2
    },
    {
     "t": 6,
     "pos": [
      1.8,
      2.2,
      1.8
     ],
     "rot": [
      0,
      45,
      0
     ],
     "scale": 1.8
    }
   ]
  },
  {
   "id": "tagline",
   "type": "text",
   "text": "Every lap counts.",
   "height_m": 0.8,
   "color": "#ffffff",
   "keyframes": [
    {
     "t": 7,
     "pos": [
      -4.5,
      3.2,
      -0.3
     ],
     "rot": [
      0,
      0,
      0
     ],
     "scale": 1.0
    }
   ]
  }
 ],
 "backdrop": {
  "type": "room",
  "depth_m": 6,
  "color": "#0b0d14"
 }
}