{
 "duration_s": 10,
 "fps": 30,
 "backdrop": {
  "type": "room",
  "depth_m": 6,
  "color": "#05070d"
 },
 "objects": [
  {
   "id": "gp_car",
   "type": "photo",
   "image": "web/hero/assets/car_gp_on_black.png",
   "width_m": 8.0,
   "blend": "add",
   "keyframes": [
    {
     "t": 0,
     "pos": [
      -8.0,
      0.5,
      -0.8
     ],
     "rot": [
      0,
      45,
      0
     ],
     "scale": 0.7
    },
    {
     "t": 2.5,
     "pos": [
      -5.0,
      0.8,
      -0.8
     ],
     "rot": [
      0,
      45,
      0
     ],
     "scale": 0.9
    },
    {
     "t": 4.5,
     "pos": [
      -1.4,
      1.0,
      -0.8
     ],
     "rot": [
      0,
      45,
      0
     ],
     "scale": 1.0
    },
    {
     "t": 6.0,
     "pos": [
      1.2,
      1.4,
      1.2
     ],
     "rot": [
      0,
      45,
      0
     ],
     "scale": 1.05
    }
   ]
  },
  {
   "id": "tag_l",
   "type": "text",
   "text": "Every lap",
   "height_m": 0.9,
   "color": "#FFFFFF",
   "keyframes": [
    {
     "t": 6.5,
     "pos": [
      -6.5,
      1.0,
      -0.3
     ],
     "rot": [
      0,
      0,
      0
     ],
     "scale": 1.0
    }
   ]
  },
  {
   "id": "tag_r",
   "type": "text",
   "text": "counts.",
   "height_m": 0.9,
   "color": "#FFD400",
   "keyframes": [
    {
     "t": 7.2,
     "pos": [
      -0.3,
      1.0,
      -6.5
     ],
     "rot": [
      0,
      90,
      0
     ],
     "scale": 1.0
    }
   ]
  }
 ]
}